{
  "catalog": {
    "id": "rubii.compound-library",
    "version": "1.0.0",
    "language": "th",
    "stage": "foundation-batch",
    "updated": "2026-09-24",
    "entryCount": 50,
    "description": "คลัง Compound สำหรับประกอบ Themeplate การ์ด ใช้ข้อมูลตัวอย่างแบบ placeholder และ SVG ภายในโปรเจกต์เท่านั้น",
    "sources": {
      "palettes": "data/json/color_palettes_100.json",
      "typography": "data/json/typography_50.json",
      "themeplates": "data/json/theme_extended.json",
      "legacyComponents": "data/json/theme_components.json",
      "previewSprite": "data/svg/compound_preview_sprite.svg"
    },
    "runtimeConstraints": {
      "minimumViewportPx": 320,
      "maximumViewportPx": 440,
      "cardOutput": "HTML-CSS-Zero-JS",
      "externalImageUrls": false,
      "motionFallback": "prefers-reduced-motion"
    }
  },
  "tokenContract": [
    "--theme-primary",
    "--theme-secondary",
    "--theme-accent",
    "--theme-surface",
    "--theme-surface-raised",
    "--theme-text",
    "--theme-muted",
    "--theme-border"
  ],
  "categories": [
    { "id": "frame", "name": "กรอบการ์ด", "count": 10 },
    { "id": "surface", "name": "พื้นผิว", "count": 8 },
    { "id": "motion", "name": "เอฟเฟกต์เคลื่อนไหว", "count": 10 },
    { "id": "ornament", "name": "ลวดลายและตัวคั่น", "count": 8 },
    { "id": "information", "name": "ส่วนแสดงข้อมูล", "count": 8 },
    { "id": "interaction", "name": "ปฏิสัมพันธ์ Zero-JS", "count": 6 }
  ],
  "compounds": [
    {
      "id": "frame.neon-corner-brackets",
      "name": "Neon Corner Brackets",
      "category": "frame",
      "summary": "กรอบมุมเปิดพร้อมแสงเน้นตามมุม เหลือพื้นที่กลางกรอบให้เนื้อหาหายใจ",
      "slot": "card-shell",
      "recipe": ["วางเส้นสั้นสี่มุมด้วย pseudo-elements", "ใช้ --theme-primary กับขอบและ glow", "คงพื้นที่ด้านข้างไว้สำหรับข้อความ"],
      "copyName": "@compound/frame/neon-corner-brackets",
      "svgSymbol": "compound-frame-neon-corner-brackets",
      "paletteRoles": ["primary", "surface", "text"],
      "motion": "static",
      "performance": "low",
      "reducedMotion": "static",
      "tags": ["cyber", "frame", "mobile", "transparent"]
    },
    {
      "id": "frame.double-editorial-line",
      "name": "Double Editorial Line",
      "category": "frame",
      "summary": "กรอบเส้นคู่บาง ให้โทนหน้าโปรไฟล์แบบสิ่งพิมพ์และงานบรรณาธิการ",
      "slot": "card-shell",
      "recipe": ["วาดเส้นนอกและเส้นในด้วย border กับ inset shadow", "ใช้ --theme-border เป็นเส้นหลัก", "เว้นขอบภายในให้หัวข้อและรายละเอียด"],
      "copyName": "@compound/frame/double-editorial-line",
      "svgSymbol": "compound-frame-double-editorial-line",
      "paletteRoles": ["border", "surface", "text"],
      "motion": "static",
      "performance": "low",
      "reducedMotion": "static",
      "tags": ["editorial", "frame", "minimal", "print"]
    },
    {
      "id": "frame.archive-dashed",
      "name": "Archive Dashed Frame",
      "category": "frame",
      "summary": "เส้นประรอบการ์ดคล้ายแฟ้มจัดเก็บข้อมูลและบันทึกภาคสนาม",
      "slot": "card-shell",
      "recipe": ["ใช้เส้น dashed รอบกรอบ", "เสริมป้ายรหัสเป็น text node", "เลือกสีเส้นจาก --theme-secondary"],
      "copyName": "@compound/frame/archive-dashed",
      "svgSymbol": "compound-frame-archive-dashed",
      "paletteRoles": ["secondary", "surface", "muted"],
      "motion": "static",
      "performance": "low",
      "reducedMotion": "static",
      "tags": ["archive", "dossier", "frame", "utility"]
    },
    {
      "id": "frame.cathedral-arch-window",
      "name": "Cathedral Arch Window",
      "category": "frame",
      "summary": "ซุ้มโค้งด้านบนสร้างจุดนำสายตา เหมาะกับ Themeplate แนวพิธีการหรือแฟนตาซี",
      "slot": "card-shell",
      "recipe": ["สร้างส่วนโค้งด้วย border-radius เฉพาะด้านบน", "ใช้เส้นชั้นเดียวหรือเส้นซ้อนตามความหนาแน่น", "รักษาพื้นที่เนื้อหาหลักให้เป็นสี่เหลี่ยมอ่านง่าย"],
      "copyName": "@compound/frame/cathedral-arch-window",
      "svgSymbol": "compound-frame-cathedral-arch-window",
      "paletteRoles": ["primary", "border", "surface"],
      "motion": "static",
      "performance": "low",
      "reducedMotion": "static",
      "tags": ["arch", "fantasy", "frame", "ornate"]
    },
    {
      "id": "frame.offset-shadow",
      "name": "Offset Shadow Frame",
      "category": "frame",
      "summary": "กรอบเหลื่อมชั้นให้ความรู้สึกเป็นการ์ดกระดาษซ้อน โดยไม่ใช้รูปพื้นหลัง",
      "slot": "card-shell",
      "recipe": ["ซ้อน pseudo-element หลังกรอบหลัก", "ใช้สี --theme-secondary แบบทึบแสง", "จำกัดเงาให้อยู่ในขอบการ์ด"],
      "copyName": "@compound/frame/offset-shadow",
      "svgSymbol": "compound-frame-offset-shadow",
      "paletteRoles": ["secondary", "surface", "border"],
      "motion": "static",
      "performance": "low",
      "reducedMotion": "static",
      "tags": ["layered", "paper", "frame", "depth"]
    },
    {
      "id": "frame.ticket-perforation",
      "name": "Ticket Perforation Frame",
      "category": "frame",
      "summary": "ขอบรอยปรุและรอยบากด้านข้างให้กลิ่นอายบัตรหรือบัตรผ่าน",
      "slot": "card-shell",
      "recipe": ["สร้างรอยบากสมมาตรด้วย radial-gradient", "ใช้สีพื้นจาก --theme-surface", "ซ่อนการตกแต่งไม่ให้ทับข้อความ"],
      "copyName": "@compound/frame/ticket-perforation",
      "svgSymbol": "compound-frame-ticket-perforation",
      "paletteRoles": ["primary", "surface", "border"],
      "motion": "static",
      "performance": "low",
      "reducedMotion": "static",
      "tags": ["ticket", "frame", "badge", "retro"]
    },
    {
      "id": "frame.tarot-inner-border",
      "name": "Tarot Inner Border",
      "category": "frame",
      "summary": "กรอบด้านในเส้นซ้อนและมุมประดับ ช่วยจัดองค์ประกอบคล้ายไพ่สะสม",
      "slot": "card-shell",
      "recipe": ["สร้างกรอบในด้วย outline หรือ pseudo-element", "วางมุมประดับเป็น SVG", "ให้เนื้อหายังเลือกคัดลอกได้"],
      "copyName": "@compound/frame/tarot-inner-border",
      "svgSymbol": "compound-frame-tarot-inner-border",
      "paletteRoles": ["primary", "accent", "surface"],
      "motion": "static",
      "performance": "low",
      "reducedMotion": "static",
      "tags": ["tarot", "ornate", "frame", "fantasy"]
    },
    {
      "id": "frame.split-accent-edge",
      "name": "Split Accent Edge",
      "category": "frame",
      "summary": "ขอบสีหลักและสีรองแยกกันคนละด้าน ช่วยให้ Themeplate ดูมีทิศทาง",
      "slot": "card-shell",
      "recipe": ["แบ่งขอบด้วย linear-gradient", "ผูกสีเข้ากับ --theme-primary และ --theme-secondary", "ตรวจความต่างสีเมื่อพื้นหลังสว่าง"],
      "copyName": "@compound/frame/split-accent-edge",
      "svgSymbol": "compound-frame-split-accent-edge",
      "paletteRoles": ["primary", "secondary", "surface"],
      "motion": "static",
      "performance": "low",
      "reducedMotion": "static",
      "tags": ["duotone", "frame", "hybrid", "modern"]
    },
    {
      "id": "frame.soft-rounded-outline",
      "name": "Soft Rounded Outline",
      "category": "frame",
      "summary": "กรอบมุมมนเส้นบาง อ่านง่ายและเข้ากับ Palette ได้หลายอารมณ์",
      "slot": "card-shell",
      "recipe": ["ใช้ border และ border-radius ค่ากลาง", "แยกสีพื้นและสีขอบด้วย token", "คงความหนาเส้นให้อ่านชัดบนจอเล็ก"],
      "copyName": "@compound/frame/soft-rounded-outline",
      "svgSymbol": "compound-frame-soft-rounded-outline",
      "paletteRoles": ["border", "surface", "text"],
      "motion": "static",
      "performance": "low",
      "reducedMotion": "static",
      "tags": ["rounded", "frame", "minimal", "universal"]
    },
    {
      "id": "frame.scanline-rail",
      "name": "Scanline Rail Frame",
      "category": "frame",
      "summary": "เส้นขอบกรอบคู่กับราง scanline แบบเบา เหมาะกับงาน interface ดิจิทัล",
      "slot": "card-shell",
      "recipe": ["แยก scanline เป็น pseudo-element แบบ pointer-events none", "ใช้ repeating-linear-gradient ความต่างสีต่ำ", "อย่าเคลื่อนไหว texture ทั้งแผ่น"],
      "copyName": "@compound/frame/scanline-rail",
      "svgSymbol": "compound-frame-scanline-rail",
      "paletteRoles": ["primary", "surface", "muted"],
      "motion": "static",
      "performance": "medium",
      "reducedMotion": "static",
      "tags": ["scanline", "cyber", "frame", "hud"]
    },
    {
      "id": "surface.frosted-glass-panel",
      "name": "Frosted Glass Panel",
      "category": "surface",
      "summary": "พื้นผิวโปร่งแสงและขอบฝ้า แยกชั้นข้อมูลจากพื้นที่ด้านหลัง",
      "slot": "card-panel",
      "recipe": ["ใช้ rgba จาก --theme-surface", "ใส่ backdrop-filter แบบคงที่เมื่อรองรับ", "กำหนดสี fallback ที่อ่านได้เมื่อไม่มี blur"],
      "copyName": "@compound/surface/frosted-glass-panel",
      "svgSymbol": "compound-surface-frosted-glass",
      "paletteRoles": ["surface", "border", "text"],
      "motion": "static",
      "performance": "medium",
      "reducedMotion": "static",
      "tags": ["glass", "translucent", "surface", "universal"]
    },
    {
      "id": "surface.paper-stack",
      "name": "Paper Stack Surface",
      "category": "surface",
      "summary": "พื้นกระดาษซ้อนชั้นด้วย gradient และเงานิ่ง ไม่มีไฟล์ texture ภายนอก",
      "slot": "card-panel",
      "recipe": ["ใช้ linear-gradient หลายชั้นแทนภาพพื้น", "เพิ่มเงาเบาเฉพาะขอบ", "เลือกสีพื้นจาก --theme-surface"],
      "copyName": "@compound/surface/paper-stack",
      "svgSymbol": "compound-surface-paper-stack",
      "paletteRoles": ["surface", "border", "muted"],
      "motion": "static",
      "performance": "low",
      "reducedMotion": "static",
      "tags": ["paper", "surface", "editorial", "texture-free"]
    },
    {
      "id": "surface.midnight-gradient-well",
      "name": "Midnight Gradient Well",
      "category": "surface",
      "summary": "พื้นไล่ระดับมืดเป็นแอ่งกลางการ์ดสำหรับวางข้อมูลสว่าง",
      "slot": "card-panel",
      "recipe": ["ใช้ radial-gradient แบบนิ่ง", "วางข้อความด้วย --theme-text", "ใช้สี --theme-primary เฉพาะจุดเน้น"],
      "copyName": "@compound/surface/midnight-gradient-well",
      "svgSymbol": "compound-surface-midnight-gradient",